{
  "system": "W3_HB_team_BXCGICOG",
  "version": "0.4.0",
  "mode": "RMB",
  "authority": "BBX19",
  "modules": [
    {
      "name": "ChatGPT",
      "tier": "L1",
      "status": "ready",
      "role": "Architecture / Flow / Execution",
      "trust": 0.95
    }
  ],
  "routing": {
    "design": "ChatGPT"
  }
}
